{
  "soe_id": "SOE-E2026-03-10-001",
  "event_id": "E2026-03-10-001",
  "asset_id": "U1-RPS-CORE",
  "generated_at": "2026-03-10T16:00:00Z",
  "window": {
    "start": "2026-03-10T14:21:00Z",
    "end": "2026-03-10T14:24:00Z"
  },
  "source": {
    "recorder_id": "SOE-RECORDER-U1-RPS",
    "source_system": "U1-DCS-SOE",
    "timezone": "UTC"
  },
  "records": [
    {
      "record_id": "SOE-001",
      "sequence_index": 1,
      "timestamp": "2026-03-10T14:21:18Z",
      "signal_id": "U1-FCV-FW-3301",
      "signal_label": "Feedwater Control Valve SG-3 Position",
      "component_id": "U1-FCV-FW-3301",
      "transition": "state_change",
      "old_state": "NORMAL",
      "new_state": "DEVIATION",
      "priority": "medium",
      "is_protection_signal": false,
      "protection_logic_ref": null,
      "remarks": "FCV-FW-3301 position deviation 4% from setpoint — 45 seconds before NI-4 trip signal"
    },
    {
      "record_id": "SOE-002",
      "sequence_index": 2,
      "timestamp": "2026-03-10T14:22:03Z",
      "signal_id": "U1-NI-RPS-4A",
      "signal_label": "Neutron Flux Channel 4 RPS Trip",
      "component_id": "U1-NI-RPS-4A",
      "transition": "trip",
      "old_state": "NORMAL",
      "new_state": "TRIP",
      "priority": "critical",
      "is_protection_signal": true,
      "protection_logic_ref": "LOGIC-RPS-NI-TRIP",
      "remarks": "NI channel 4 exceeded 105% rated power trip setpoint at 112.3%. RPS initiates SCRAM. Channels 1, 2, 3 do not respond."
    },
    {
      "record_id": "SOE-003",
      "sequence_index": 3,
      "timestamp": "2026-03-10T14:22:03.8Z",
      "signal_id": "U1-CRD-BANK-A-INSERT",
      "signal_label": "Control Rod Bank A Full Insertion",
      "component_id": "U1-RPS-CORE",
      "transition": "close",
      "old_state": "WITHDRAWN",
      "new_state": "INSERTED",
      "priority": "critical",
      "is_protection_signal": true,
      "protection_logic_ref": "LOGIC-RPS-SCRAM",
      "remarks": "Bank A CRDs confirmed fully inserted 0.8s after trip signal — within design basis"
    },
    {
      "record_id": "SOE-004",
      "sequence_index": 4,
      "timestamp": "2026-03-10T14:22:05.4Z",
      "signal_id": "U1-CRD-BANKS-BCD-INSERT",
      "signal_label": "Control Rod Banks B-C-D Full Insertion",
      "component_id": "U1-RPS-CORE",
      "transition": "close",
      "old_state": "WITHDRAWN",
      "new_state": "INSERTED",
      "priority": "critical",
      "is_protection_signal": true,
      "protection_logic_ref": "LOGIC-RPS-SCRAM",
      "remarks": "Banks B, C, D CRDs confirmed fully inserted 2.4s after trip signal — within design basis"
    },
    {
      "record_id": "SOE-005",
      "sequence_index": 5,
      "timestamp": "2026-03-10T14:22:13Z",
      "signal_id": "U1-ZI-CRD-2214",
      "signal_label": "CRD 2214 Position Indicator Step Change",
      "component_id": "U1-CRD-2214",
      "transition": "state_change",
      "old_state": "NORMAL",
      "new_state": "DEVIATION",
      "priority": "medium",
      "is_protection_signal": false,
      "protection_logic_ref": null,
      "remarks": "CRD-2214 position indicator 2-step change at T+10s after NI-4 trip initiator — timing consistent with rod insertion consequence, not cause"
    },
    {
      "record_id": "SOE-006",
      "sequence_index": 6,
      "timestamp": "2026-03-10T14:23:33Z",
      "signal_id": "OPERATOR-ACTION",
      "signal_label": "Operator Procedure Entry",
      "component_id": null,
      "transition": "state_change",
      "old_state": null,
      "new_state": "LOGGED",
      "priority": "informational",
      "is_protection_signal": false,
      "protection_logic_ref": null,
      "remarks": "Operator entered EOP-E.0 per SCRAM procedure. Reactor subcritical confirmed. Post-trip review initiated."
    }
  ],
  "quality": {
    "clock_sync_ok": true,
    "dropped_record_count": 0,
    "duplicate_record_count": 0,
    "quality_flags": []
  },
  "provenance": {
    "generated_by": "show-and-tell-fixture-generator",
    "query_params": {"test_case": "TC-4", "scenario": "reactor-trip-ni-spurious"}
  }
}
