{
  "soe_id": "SOE-E2026-04-15-001",
  "event_id": "E2026-04-15-001",
  "asset_id": "CONDENSER_TRAIN_A",
  "generated_at": "2026-04-15T15:00:00Z",
  "window": {
    "start": "2026-04-15T13:10:00Z",
    "end": "2026-04-15T14:15:00Z"
  },
  "source": {
    "recorder_id": "SOE-RECORDER-U1-SEC",
    "source_system": "U1-DCS-SOE",
    "timezone": "UTC"
  },
  "records": [
    {
      "record_id": "SOE-001",
      "sequence_index": 1,
      "timestamp": "2026-04-15T13:22:00Z",
      "signal_id": "U1-DPT-AR-2201B",
      "signal_label": "Air Removal Train B Differential Pressure",
      "component_id": "U1-AIR-EJECTOR-B",
      "transition": "assert",
      "old_state": "NORMAL",
      "new_state": "HIGH",
      "priority": "high",
      "is_protection_signal": false,
      "protection_logic_ref": null,
      "remarks": "Air removal train B DP trending above setpoint 4.8 inH2O"
    },
    {
      "record_id": "SOE-002",
      "sequence_index": 2,
      "timestamp": "2026-04-15T13:24:00Z",
      "signal_id": "U1-PT-CND-4201",
      "signal_label": "Condenser Backpressure",
      "component_id": "CONDENSER_TRAIN_A",
      "transition": "assert",
      "old_state": "NORMAL",
      "new_state": "ALARM",
      "priority": "high",
      "is_protection_signal": true,
      "protection_logic_ref": "LOGIC-TURB-TRIP-VACLO",
      "remarks": "Condenser backpressure first threshold alarm at 1.85 inHgA"
    },
    {
      "record_id": "SOE-003",
      "sequence_index": 3,
      "timestamp": "2026-04-15T13:26:00Z",
      "signal_id": "U1-PT-CND-4201",
      "signal_label": "Condenser Backpressure",
      "component_id": "CONDENSER_TRAIN_A",
      "transition": "state_change",
      "old_state": "ALARM",
      "new_state": "HIGH",
      "priority": "critical",
      "is_protection_signal": true,
      "protection_logic_ref": "LOGIC-TURB-TRIP-VACLO",
      "remarks": "Condenser backpressure high alarm — 2.10 inHgA; turbine runback initiated"
    },
    {
      "record_id": "SOE-004",
      "sequence_index": 4,
      "timestamp": "2026-04-15T13:31:00Z",
      "signal_id": "U1-LT-HW-3301",
      "signal_label": "Hotwell Level",
      "component_id": "U1-HOTWELL",
      "transition": "assert",
      "old_state": "NORMAL",
      "new_state": "HIGH",
      "priority": "medium",
      "is_protection_signal": false,
      "protection_logic_ref": null,
      "remarks": "Hotwell level high; consistent with non-condensable gas accumulation"
    },
    {
      "record_id": "SOE-005",
      "sequence_index": 5,
      "timestamp": "2026-04-15T13:34:00Z",
      "signal_id": "U1-FT-FW-2101A",
      "signal_label": "Feedwater Flow Train A",
      "component_id": "U1-FW-PUMP-A",
      "transition": "state_change",
      "old_state": "NORMAL",
      "new_state": "DEVIATION",
      "priority": "medium",
      "is_protection_signal": false,
      "protection_logic_ref": null,
      "remarks": "Feedwater flow deviation ±1.2% — consistent with turbine power reduction"
    },
    {
      "record_id": "SOE-006",
      "sequence_index": 6,
      "timestamp": "2026-04-15T14:00:00Z",
      "signal_id": "OPERATOR-ACTION",
      "signal_label": "Operator Logged Action",
      "component_id": null,
      "transition": "state_change",
      "old_state": null,
      "new_state": "LOGGED",
      "priority": "informational",
      "is_protection_signal": false,
      "protection_logic_ref": null,
      "remarks": "Operator initiated 5% load reduction per AOP-10 — condenser vacuum recovery in progress"
    }
  ],
  "quality": {
    "clock_sync_ok": true,
    "dropped_record_count": 0,
    "duplicate_record_count": 0,
    "quality_flags": []
  },
  "provenance": {
    "generated_by": "show-and-tell-fixture-generator",
    "query_params": {
      "test_case": "TC-2",
      "scenario": "condenser-vacuum-loss-pwr-u1"
    }
  }
}
